Investor_Name,Type,Locations,Check_Size_Min,Check_Size_Max,Stage,Requirements,Industries,Website,Logo_URL
Vesna Capital,VC firm,"Ukraine, Poland+14",50000,200000,"3. Early Revenue, 4. Scaling",We invest in startups from CEE and Nordic regions at pre-seed and seed stages. Our average check size is $50-200k. We...,,https://www.openvc.app/fund/Vesna%20Capital,https://www.openvc.app/images/funds/rec7230rmZNTOUiIH.jpg
SCE Freiraum Ventures,VC firm,"Germany, Austria+10",50000,150000,"2. Prototype, 3. Early Revenue",We invest in early-stage teams that have developed a scalable business idea with initial traction and a defensible...,,https://www.openvc.app/fund/SCE%20Freiraum%20Ventures,https://www.openvc.app/images/funds/rec0CXaqwTROVQb84.jpg
First Momentum Venture...,VC firm,"Albania, Andorra+39",200000,1000000,1. Idea or Patent,We invest in pre/early-traction B2B companies with a technical core as their main differentiator. We mainly invest in...,,https://www.openvc.app/fund/First%20Momentum%20Ventures,https://www.openvc.app/images/funds/recH5m8UW5yJUsCeb.jpg
No Brand,Family office,"Australia, New Zealand",25000,1000000,"3. Early Revenue, 4. Scaling","We invest in Australian or New Zealand startups in Seed or Series A rounds. Our areas of interest include: AI, ML,...",,https://www.openvc.app/fund/No%20Brand,https://www.openvc.app/images/funds/rec2z1pZEgUybJBI3.jpg
BH3 Growth Equity,PE fund,"USA, Canada",5000000,30000000,"4. Scaling, 5. Growth+2","We invest in proptech, construction technology, sustainable building materials, modular construction, property...",,https://www.openvc.app/fund/BH3%20Growth%20Equity,https://www.openvc.app/images/funds/receFC1tdaYtHgb7L.jpg
Sabban Corp Investment,Family office,UAE,50000,600000,"3. Early Revenue, 4. Scaling+3","We invest in Fintech, Manufacturing, Agriculture, Software, IoT, Logistics,...",,https://www.openvc.app/fund/Sabban%20Corp%20Investment,https://www.openvc.app/images/funds/recwyrSwaFA27DoOg.jpg
Lukkap Venture Lab,VC firm,Spain,50000,150000,"1. Idea or Patent, 2. Prototype+1",We invest in early stage startups that have already developed a product with a market fit. Our pre-money valuation...,,https://www.openvc.app/fund/Lukkap%20Venture%20Lab,https://www.openvc.app/images/funds/recMaAujdPSjRs8b1.jpg
Clint Capital,VC firm,France,300000,500000,"1. Idea or Patent, 3. Early Revenue","We invest in all business sectors (Fintech, SaaS, marketplace, greentech, healthtech, agritech, etc), but only in...",,https://www.openvc.app/fund/Clint%20Capital,https://www.openvc.app/images/funds/recyqBT4wDVcVVJC2.jpg
Turenne Santé,PE fund,"France, Switzerland+4",1000000,3000000,"3. Early Revenue, 4. Scaling+1","We invest in Medtech, e-health, Software, service, CDMO/CRO innovationm, health. Early revenue/growth, non...",,https://www.openvc.app/fund/Turenne%20Sant%C3%A9,https://www.openvc.app/images/funds/recjglKYu9C3C0W3c.jpg
gAI Ventures,Startup studio,"USA, India",100000,100000,1. Idea or Patent,We incubate vertical AI products with domain experts in financial services and insurance (FSI)...,,https://www.openvc.app/fund/gAI%20Ventures,https://www.openvc.app/images/funds/recPYbjMSLZ9j1qwP.jpg
Ascendo VC,VC firm,USA,100000,500000,3. Early Revenue,We invest in Seed to Series A Companies led by founders from underrepresented segments. Technology-based business...,,https://www.openvc.app/fund/Ascendo%20VC,https://www.openvc.app/images/funds/rec9skLoYah4AtTmj.jpg
Capital Factory,VC firm,USA,25000,200000,"2. Prototype, 3. Early Revenue+1","We invest in US-based technology companies where we can add additional value through our help with customer, employee,...",,https://www.openvc.app/fund/Capital%20Factory,https://www.openvc.app/images/funds/recWrFydM5qmGnARr.jpg
Curiosity VC,VC firm,"Belgium, Denmark+8",500000,1000000,"3. Early Revenue, 4. Scaling","We invest in B2B software with a focus on applications of AI in Fintech, Proptech, Legaltech, Enterprise Software,...",,https://www.openvc.app/fund/Curiosity%20VC,https://www.openvc.app/images/funds/rec3gd1aG2ZZHO8iI.jpg
TSP Ventures,Angel network,UK,70000,700000,"3. Early Revenue, 2. Prototype+1",We invest in UK-based Climate / CleanTech and InsurTech companies (from Pre Seed to Seed Extension rounds)...,,https://www.openvc.app/fund/TSP%20Ventures,https://www.openvc.app/images/funds/recP3NKyUMH7vH68M.jpg
Norselab,VC firm,"Norway, Sweden+9",1.5000000,5000000,"3. Early Revenue, 4. Scaling+1","We invest in impact startups primarily in the Nordics. Investment Themes: Energy Transition, Circularity & Sustainable...",,https://www.openvc.app/fund/Norselab,https://www.openvc.app/images/funds/recUeW0LDZYgdMXdh.jpg
HTGF High-Tech Gründe...,VC firm,"Austria, Belgium+9",300000,1000000,"2. Prototype, 3. Early Revenue","We invest in early-stage companies with focus on B2B SaaS models, but also look into other opportunities. The venture...",,https://www.openvc.app/fund/HTGF%20High-Tech%20Gr%C3%BCnderfonds,https://www.openvc.app/images/funds/rectoRcYjkV5yvPS2.jpg
Singtel Innov8,Corporate VC,"Singapore, Australia+3",1000000,5000000,"3. Early Revenue, 4. Scaling+1","We invest in 5G Enterprise & Applications, Data Privacy & Security, New Emerging...",,https://www.openvc.app/fund/Singtel%20Innov8,https://www.openvc.app/images/funds/recC8lr96CV1A7h2P.jpg
OVC Ventures,Angel network,"UK, USA+25",150000,1.5000000,"3. Early Revenue, 4. Scaling+1","We invest in all sectors, move fast (two weeks), have a high preference for startups that can demonstrate initial...",,https://www.openvc.app/fund/OVC%20Ventures,https://www.openvc.app/images/funds/recTPpyulE0uJpv8E.jpg
Doug Hickey,Solo angel,USA,25000,200000,"1. Idea or Patent, 2. Prototype+3",I invest in product-first companies that are looking to solve problems for their...,,https://www.openvc.app/fund/Doug%20Hickey,https://www.openvc.app/images/funds/recricy144rMMbHOI.jpg
Colin Weston,Solo angel,"Switzerland, UK",10000,50000,"2. Prototype, 3. Early Revenue+1","I invest in fintech, regtech, legaltech, proptech",,https://www.openvc.app/fund/Colin%20Weston,https://www.openvc.app/images/funds/recJBoUbSuaEAbz1C.jpg
