Investor_Name,Type,Locations,Check_Size_Min,Check_Size_Max,Stage,Requirements,Industries,Website,Logo_URL
MediaTech Hub Accelera...,"Incubator, Accelerator",Germany,N/A,,"1. Idea or Patent, 2. Prototype+1",We invest in Media Tech,,https://www.openvc.app/fund/MediaTech%20Hub%20Accelerator,https://www.openvc.app/images/funds/reccDx4WUPPneO2hJ.jpg
Underline Ventures,VC firm,"Albania, Belarus+18",200000,1000000,"1. Idea or Patent, 2. Prototype+1",We invest in Eastern European founders building high-growth startups with global ambitions. We are...,,https://www.openvc.app/fund/Underline%20Ventures,https://www.openvc.app/images/funds/recjJ6VPbaQmUo6pB.jpg
Colin Weston,Solo angel,"Switzerland, UK",10000,50000,"2. Prototype, 3. Early Revenue+1","I invest in fintech, regtech, legaltech, proptech",,https://www.openvc.app/fund/Colin%20Weston,https://www.openvc.app/images/funds/recJBoUbSuaEAbz1C.jpg
Ascendo VC,VC firm,USA,100000,500000,3. Early Revenue,We invest in Seed to Series A Companies led by founders from underrepresented segments. Technology-based business...,,https://www.openvc.app/fund/Ascendo%20VC,https://www.openvc.app/images/funds/rec9skLoYah4AtTmj.jpg
Lukkap Venture Lab,VC firm,Spain,50000,150000,"1. Idea or Patent, 2. Prototype+1",We invest in early stage startups that have already developed a product with a market fit. Our pre-money valuation...,,https://www.openvc.app/fund/Lukkap%20Venture%20Lab,https://www.openvc.app/images/funds/recMaAujdPSjRs8b1.jpg
BH3 Growth Equity,PE fund,"USA, Canada",5000000,30000000,"4. Scaling, 5. Growth+2","We invest in proptech, construction technology, sustainable building materials, modular construction, property...",,https://www.openvc.app/fund/BH3%20Growth%20Equity,https://www.openvc.app/images/funds/receFC1tdaYtHgb7L.jpg
Vesna Capital,VC firm,"Ukraine, Poland+14",50000,200000,"3. Early Revenue, 4. Scaling",We invest in startups from CEE and Nordic regions at pre-seed and seed stages. Our average check size is $50-200k. We...,,https://www.openvc.app/fund/Vesna%20Capital,https://www.openvc.app/images/funds/rec7230rmZNTOUiIH.jpg
Norselab,VC firm,"Norway, Sweden+9",1.5000000,5000000,"3. Early Revenue, 4. Scaling+1","We invest in impact startups primarily in the Nordics. Investment Themes: Energy Transition, Circularity & Sustainable...",,https://www.openvc.app/fund/Norselab,https://www.openvc.app/images/funds/recUeW0LDZYgdMXdh.jpg
Doug Hickey,Solo angel,USA,25000,200000,"1. Idea or Patent, 2. Prototype+3",I invest in product-first companies that are looking to solve problems for their...,,https://www.openvc.app/fund/Doug%20Hickey,https://www.openvc.app/images/funds/recricy144rMMbHOI.jpg
Capital Factory,VC firm,USA,25000,200000,"2. Prototype, 3. Early Revenue+1","We invest in US-based technology companies where we can add additional value through our help with customer, employee,...",,https://www.openvc.app/fund/Capital%20Factory,https://www.openvc.app/images/funds/recWrFydM5qmGnARr.jpg
LvlUp Ventures,Corporate VC,"Canada, USA+11",200000,1000000,"1. Idea or Patent, 2. Prototype+2",We invest in startups with early traction (industry-agnostic) - preferred mature seed companies with 50K min...,,https://www.openvc.app/fund/LvlUp%20Ventures,https://www.openvc.app/images/funds/recrw4qRk7OgQg3RF.jpg
Team8,VC firm,Israel,1000000,20000000,"1. Idea or Patent, 2. Prototype+2","We invest in, Cyber, FinTech, Enterprise Applications, Infrastructure & DevOps",,https://www.openvc.app/fund/Team8,https://www.openvc.app/images/funds/recBs6XhJsM1Fy0YE.jpg
Okya Ventures,Angel network,USA,100000,200000,3. Early Revenue,"We invest in pre-seed/seed stage startups with the following focus areas: AI/ML, Deep Tech, Enterprise Software,...",,https://www.openvc.app/fund/Okya%20Ventures,https://www.openvc.app/images/funds/recOPW02gsyzoRpxS.jpg
Via ID,Corporate VC,"Austria, Belgium+26",300000,5000000,3. Early Revenue,"We invest in European-based startups in the sustainable mobility (micromobility, electric vehicles, connected vehicles,...",,https://www.openvc.app/fund/Via%20ID,https://www.openvc.app/images/funds/recIN6myiB96exApd.jpg
AIP Seed VC,VC firm,Poland,50000,400000,"1. Idea or Patent, 2. Prototype+1",We invest in founders of all origins who wants to build something amazing from Poland or are polish diaspora. We are...,,https://www.openvc.app/fund/AIP%20Seed%20VC,https://www.openvc.app/images/funds/recR2OxZK87Wr08S2.jpg
Katha VC,VC firm,"Botswana, Kenya+23",100000,500000,"2. Prototype, 3. Early Revenue+2",We invest in Pre-Seed and Seed High Growth Markets Fintech. We also consider non-fintech companies where embedded...,,https://www.openvc.app/fund/Katha%20VC,https://www.openvc.app/images/funds/recPHuZihRMJFpLS6.jpg
Skilltor Tech Venture ...,Startup studio,"Zimbabwe, Afghanistan+16",500000,1000000,"1. Idea or Patent, 2. Prototype+4","We invest in Web3, AI, Digital Trust, Infrastructure Software, Saas, Marketplace and Gaming startups with in a MVP...",,https://www.openvc.app/fund/Skilltor%20Tech%20Venture%20Studio,https://www.openvc.app/images/funds/recrJ9bxGwah1RCla.jpg
Abac Nest Ventures,VC firm,Spain,150000,500000,"1. Idea or Patent, 2. Prototype+1",We invest in outlier entrepreneurs building B2S SaaS solutions to transform the SME industry across Southern...,,https://www.openvc.app/fund/Abac%20Nest%20Ventures,https://www.openvc.app/images/funds/rec2Q9z60OgvA883Y.jpg
Ascentro Capital Partn...,PE fund,"New Zealand, USA+1",5000000,100000000,5. Growth,"We invest in AI, Fintech, Cybersecurity, Health, Hardware, Ecommerce, Marketplaces, Education, Enterprise, Childcare,...",,https://www.openvc.app/fund/Ascentro%20Capital%20Partners,https://www.openvc.app/images/funds/rec2FUcTVMjO6h7MI.jpg
Curiosity VC,VC firm,"Belgium, Denmark+8",500000,1000000,"3. Early Revenue, 4. Scaling","We invest in B2B software with a focus on applications of AI in Fintech, Proptech, Legaltech, Enterprise Software,...",,https://www.openvc.app/fund/Curiosity%20VC,https://www.openvc.app/images/funds/rec3gd1aG2ZZHO8iI.jpg
